review_id,shop_id,item_id,user_id,rating_star,comment,created_at,like_count,product_items,source
Đỗ Văn Toàn_182830,FPTShop,00921922,Đỗ Văn Toàn,5,"Con máy mượt mà quá, mở nhiều ứng dụng cùng lúc vẫn nhanh như thường. Pin trâu, dùng cả ngày chỉ cần sạc một lần thôi.",,0,,FPTShop
Hoàng Trọng Nghĩa_145824,FPTShop,00919250,Hoàng Trọng Nghĩa,5,"Máy khởi động cực nhanh, chưa đến 10 giây vào Windows. Nhân viên hỗ trợ update BIOS mới nhất.",,0,,FPTShop
Hồ Văn Khánh_143844,FPTShop,00919250,Hồ Văn Khánh,5,"Bàn phím fullsize có numpad, nhập số tiện. FPT hướng dẫn đầy đủ cách bảo quản pin.",,0,,FPTShop
Doãn Tuấn Kiệt_143331,FPTShop,00919250,Doãn Tuấn Kiệt,5,"Máy tản nhiệt cực tốt, quạt to nhưng giữ máy mát. FPT giải thích kỹ cách tối ưu quạt bằng phần mềm Lenovo Vantage.",,0,,FPTShop
Đỗ Thảo Nhi_142271,FPTShop,00919250,Đỗ Thảo Nhi,5,Giá cao nhưng đáng cho game thủ chuyên nghiệp. FPT có tổng đài hỗ trợ kỹ thuật rất nhanh.,,0,,FPTShop
Trần Minh Châu_141846,FPTShop,00919250,Trần Minh Châu,5,"Card RTX 5080 mạnh mẽ, chơi game 4K mượt. FPT giao nhanh",,1,,FPTShop
Võ Thanh Phong_141337,FPTShop,00919250,Võ Thanh Phong,5,"Máy tản nhiệt cực tốt, quạt to nhưng giữ máy mát. FPT giải thích kỹ cách tối ưu quạt bằng phần mềm Lenovo Vantage.",,0,,FPTShop
Đinh Thị Kim Oanh_145108,FPTShop,00913961,Đinh Thị Kim Oanh,5,"Pin dùng nhẹ (Office + web) khoảng 4–5 giờ, nhưng khi chơi game hoặc chạy tác vụ nặng thì tụt rất nhanh — nên cắm sạc khi chơi lâu",,0,,FPTShop
Phan Anh Tuấn_144653,FPTShop,00913961,Phan Anh Tuấn,5,"Tản nhiệt tương đối hiệu quả — khi chơi game 1–2 tiếng máy hơi ấm vùng đáy, quạt kêu rõ hơn nhưng vẫn trong mức chấp nhận được nếu bạn không đòi sự im lặng tuyệt đối.",,0,,FPTShop
Bùi Khánh Hòa_143967,FPTShop,00913961,Bùi Khánh Hòa,5,"Máy mở ứng dụng & load game rất nhanh — SSD 512GB + hệ thống tối ưu giúp mọi thao tác như bật app, chuyển map đều diễn ra rất lẹ.",,0,,FPTShop
Hoàng Nhật Minh_142925,FPTShop,00913961,Hoàng Nhật Minh,5,"RAM 16GB đủ “trụ” cho đa nhiệm: mở Chrome nhiều tab + Discord + phần mềm đồ họa nhẹ mà máy vẫn giữ được ổn định, không bị giật.",,0,,FPTShop
Lê Trọng Nghĩa_141644,FPTShop,00913961,Lê Trọng Nghĩa,5,"Thiết kế máy nhìn vừa hầm hố vừa thanh lịch — mặt lưng có hoạ tiết ProPanel, vỏ chắc chắn, không cảm giác rẻ tiền.",,0,,FPTShop
Lý Thị Thu Trang_143560,FPTShop,00909188,Lý Thị Thu Trang,5,CPU Ultra 7 + GPU RTX 4050 chạy mượt game AAA ở setting cao.,,0,,FPTShop
Thào A Páo_143296,FPTShop,00909188,Thào A Páo,4,"Bảo hành lâu dài nên cũng yên tâm, còn được bảo hành tại cửa hàng thì càng yên tâm",,0,,FPTShop
Lý Hồng Phúc_142511,FPTShop,00909188,Lý Hồng Phúc,5,Tư vấn hỗ trợ cài đặt miễn phí tại cửa hàng,,0,,FPTShop
Phạm Thu Thủy_141595,FPTShop,00909188,Phạm Thu Thủy,5,"Pin dùng 6-8 tiếng, đủ cho 1 ngày làm việc.",,0,,FPTShop
Đỗ Hữu Toàn_141594,FPTShop,00909188,Đỗ Hữu Toàn,5,"Hỗ trợ AI tăng hiệu suất xử lý, máy thông minh hơn.",,0,,FPTShop
Phan Thị Thu Hằng_144627,FPTShop,00915532,Phan Thị Thu Hằng,5,"Màn cong 32 inch bao trùm tầm nhìn, xem phim hay chơi game đều phê. Cảm giác chìm trong khung hình, trải nghiệm thực tế vượt mong đợi.",,0,,FPTShop
Lê Thanh Vân_144556,FPTShop,00915532,Lê Thanh Vân,5,"Mình đánh giá cao thái độ tư vấn bên FPT, nhân viên nói rõ ưu nhược điểm từng loại màn, không ép mua. Thêm chế độ bảo hành chính hãng nên rất an tâm khi xuống tiền.",,0,,FPTShop
Lê Anh Quân_144398,FPTShop,00915532,Lê Anh Quân,4,"Ban đầu định mua màn 165Hz hãng khác nhưng so qua thì thấy con này thiết kế cong, tần số quét cao hơn mà giá lại hợp lý nên đổi quyết định luôn.",,0,,FPTShop
Trần Văn Toản_144397,FPTShop,00915532,Trần Văn Toản,5,"Đặt máy trên bàn học, ánh sáng từ cửa sổ chiếu vào màn hình vẫn thấy rõ nhờ lớp chống chói; viền màn hình mỏng cũng làm máy nhìn sang và hiện đại",,0,,FPTShop
Ngô Hồng Phát_143631,FPTShop,00915532,Ngô Hồng Phát,5,"Mình thử làm việc đêm, đèn bàn tối; bàn phím LED trắng đủ sáng, không lóa mắt. Thích máy ultrabook kiểu này vì vừa văn phòng vừa di chuyển nhiều.",,0,,FPTShop
Hầu A Chử_143494,FPTShop,00915532,Hầu A Chử,5,"Hình ảnh rõ, màu sắc tươi, tốc độ phản hồi nhanh, ViewSonic đúng là không làm thất vọng. Mua tại nơi uy tín như FPT thì càng yên tâm.",,0,,FPTShop
Bùi Thị Kim Chi_51349,FPTShop,00909189,Bùi Thị Kim Chi,4,"máy xài rất tốt, mới mua 2 tháng nên chưa có vấn đề gì. Nhưng pin không như quảng cáo",,0,,FPTShop
Nguyễn Quang Khải_51345,FPTShop,00909189,Nguyễn Quang Khải,5,"Máy khởi động nhanh, màng hình đẹp, chạy không thấy bị nóng\n\n",,0,,FPTShop
Phạm Hương Giang_51342,FPTShop,00909189,Phạm Hương Giang,4,Máy tốt trong tầm giá\n\n,,0,,FPTShop
Đỗ Văn Hiếu_51340,FPTShop,00909189,Đỗ Văn Hiếu,5,"Đã mua em này, xài thấy màn hình đẹp nét, cấu hình mạnh .\n\n",,0,,FPTShop
Lê Thị Hồng Nhung_51335,FPTShop,00909189,Lê Thị Hồng Nhung,1,Máy mới mà nhanh hết pin chắc dùng được 3 tiếng\n\n,,0,,FPTShop
Lê Thị Bảo Ngọc_51332,FPTShop,00909189,Lê Thị Bảo Ngọc,5,"máy dùng ngon, giao lại nhanh, an tâm mua FPT là vậy",,0,,FPTShop
Thịnh Sầu_43455,FPTShop,00906451,Thịnh Sầu,5,Bàn phím gõ đã lắm anh em ạ,,0,,FPTShop
Minh Quang_43435,FPTShop,00906451,Minh Quang,5,Màn to cày phim đã lắm mn nhé,,0,,FPTShop
Quốc Cường_43423,FPTShop,00906451,Quốc Cường,5,Giá giảm tốt quá đúng lúc đang cần thay máy,,0,,FPTShop
Khánh Văn_43405,FPTShop,00906451,Khánh Văn,5,Tản nhiệt cực tốt cả nhà nhé,,0,,FPTShop
Linh Thùy_43402,FPTShop,00906451,Linh Thùy,5,Em này chiến game đúng đỉnh,,0,,FPTShop
Phi Trần_43388,FPTShop,00906451,Phi Trần,5,Dòng gaming có khác dùng thích hơn hẳn,,0,,FPTShop
Đinh Minh Quân_184121,FPTShop,00919444,Đinh Minh Quân,5,"Màn hình Liquid Retina XDR trên MacBook Pro 14 inch vẫn là đỉnh cao, độ sáng và màu sắc cực kỳ chuẩn xác. Thời lượng pin rất ấn tượng, đủ cho một ngày làm việc dài mà không cần sạc. Rất ưng ý với cách chăm sóc khách hàng và quy trình bán hàng nhanh gọn tại shop.",,0,,FPTShop
Ngô Thị Dung_184120,FPTShop,00919444,Ngô Thị Dung,5,"Máy thiết kế sang trọng, bàn phím gõ sướng và touchpad thì không có đối thủ. Bạn nhân viên tại cửa hàng hỗ trợ mình cài đặt các phần mềm cơ bản rất nhiệt tình. Dịch vụ hậu mãi chu đáo là lý do mình luôn chọn mua đồ Apple tại FPT Shop.",,0,,FPTShop
Trịnh Bích Phượng_184119,FPTShop,00919444,Trịnh Bích Phượng,5,Sản phẩm tuyệt vời cho những ai cần sự cân bằng giữa sức mạnh và tính di động. Loa nghe nhạc hay và webcam sắc nét hỗ trợ họp online rất tốt. Thái độ phục vụ của toàn bộ nhân viên từ tư vấn đến giao nhận đều rất lịch sự và tận tâm.,,0,,FPTShop
Trịnh Văn Khánh_183610,FPTShop,00919444,Trịnh Văn Khánh,5,"Chip M4 Pro xử lý đa nhiệm quá tuyệt vời, mình mở hàng chục tab trình duyệt và ứng dụng đồ họa mà máy vẫn không hề nóng. Nhân viên tư vấn của shop giới thiệu bản 48GB RAM này thực sự rất đúng đắn cho nhu cầu của mình. Giao hàng đúng hẹn và thái độ rất chuyên nghiệp.",,0,,FPTShop
Đặng Minh Anh_183141,FPTShop,00919444,Đặng Minh Anh,5,"Hiệu năng của dòng M4 Pro vượt xa mong đợi, xử lý code và xuất video nhanh hơn hẳn các đời trước. Sạc 96W đi kèm giúp nạp pin nhanh chóng, rất tiện cho người hay di chuyển. Đội ngũ kỹ thuật hỗ trợ kiểm tra máy rất kỹ lưỡng trước khi bàn giao.",,0,,FPTShop
Phú_52753,FPTShop,00911036,Phú,,"Mạnh đó, màn đẹp tản mát",,0,,FPTShop
Vũ Hồng Nhung_51800,FPTShop,00911036,Vũ Hồng Nhung,5.0,Loa âm thanh DTS:X Ultra rất sống động khi chơi game FPS.\n,,0,,FPTShop
Đạt Nguyễn_51795,FPTShop,00911036,Đạt Nguyễn,5.0,Màn hình ProPanel 165Hz cho trải nghiệm cực kỳ mượt mà.\n,,0,,FPTShop
Hồ Nhất Trung_51793,FPTShop,00911036,Hồ Nhất Trung,5.0,"Hiệu năng máy rất mạnh mẽ, phù hợp chơi game nặng và làm đồ họa.\n",,0,,FPTShop
Lý Phát Phát_51791,FPTShop,00911036,Lý Phát Phát,4.0,"Màn hình ProPanel hiển thị rất sắc nét, phù hợp chơi game và giải trí.\n",,0,,FPTShop
phát mệt_51790,FPTShop,00911036,phát mệt,3.0,"Màn hình 16 inch rộng rãi, nhưng màu sắc chưa thực sự sắc nét.\n",,0,,FPTShop
Đặng Văn Lâm_144552,FPTShop,00916389,Đặng Văn Lâm,5,"Máy Dell Inspiron 16 5640 rất ổn cho nhu cầu văn phòng và học online. Màn hình 16 inch hiển thị chi tiết, đọc tài liệu hay soạn slide đều dễ dàng.",,0,,FPTShop
Ksor H'Bơn_144349,FPTShop,00916389,Ksor H'Bơn,5,"Pin khoảng 5–6 tiếng cho tác vụ văn phòng, hơi thấp nếu di chuyển nhiều, nhưng bù lại sạc nhanh và thiết kế tiện mang theo.",,0,,FPTShop
Đinh Quang Trường_142260,FPTShop,00916389,Đinh Quang Trường,5,"Thiết kế thanh lịch, cứng cáp, màu bạc nhìn chuyên nghiệp. Máy hơi nặng khi mang đi nhưng bù lại cảm giác chắc chắn.",,0,,FPTShop
Bùi Thị Tuyết Mai_142259,FPTShop,00916389,Bùi Thị Tuyết Mai,5,"Office HS21 và Win11 cài sẵn rất tiện, mở máy là dùng được luôn. Nhân viên FPT Shop tư vấn tận tình, giao hàng nhanh, cài đặt hướng dẫn chi tiết.",,0,,FPTShop
Nguyễn Thị Khánh Chi_142258,FPTShop,00916389,Nguyễn Thị Khánh Chi,5,"Máy chạy mát, quạt êm khi làm việc văn phòng. Khi render hình hoặc mở Photoshop thì quạt hơi ồn nhưng không ảnh hưởng nhiều.",,0,,FPTShop
Sương_172022,FPTShop,00908399,Sương,,"⭐️ ⭐️ ⭐️ ⭐️ ⭐️\nMáy em dùng làm máy văn phòng rất tốt, mọi chức năng hoạt động trơn tru, công việc giải trí là phù hợp",,0,,FPTShop
Thao_140457,FPTShop,00908399,Thao,,"⭐️ ⭐️ ⭐️ ⭐️ ⭐️\nEm chọn Vivobook 15 vì màn hình 15.6 inch rộng rãi, làm báo cáo, học online hay xem tài liệu đều thoải mái. Với i5 gen 12 và 16GB RAM, em mở nhiều tab Chrome, chạy Word, Excel cùng lúc vẫn mượt.",,0,,FPTShop
Ánh Tuyết_139602,FPTShop,00908399,Ánh Tuyết,,"⭐️ ⭐️ ⭐️ ⭐️ ⭐️\nTôi chỉ dùng để đọc báo, xem phim và gọi video với con cháu, máy dễ sử dụng, màn hình chữ rõ, loa nghe đủ to. Nhẹ và gọn, mở máy nhanh",,0,,FPTShop
Luyến_139595,FPTShop,00908399,Luyến,,"⭐️ ⭐️ ⭐️ ⭐️ ⭐️\nMình mới vào đại học, cần laptop để học online và làm slide thuyết trình. Chọn Vivobook 15 vì giá vừa túi tiền, màn hình rộng 15.6 inch dễ đọc tài liệu",,0,,FPTShop
Hậu_139592,FPTShop,00908399,Hậu,,"⭐️ ⭐️ ⭐️ ⭐️ ⭐️\nNgoài học tập, mình hay xem phim, lướt web, màn hình IPS góc nhìn rộng, màu sắc tươi,bàn phím bấm êm nhẹ, khởi động nhanh mượt",,0,,FPTShop
Thương_139589,FPTShop,00908399,Thương,,"⭐️ ⭐️ ⭐️ ⭐️ ⭐️\nMình chủ yếu dùng máy để viết kịch bản, quản lý fanpage và chỉnh sửa hình ảnh nhỏ lẻ, nên Vivobook 15 khá hợp. SSD 512GB lưu trữ thoải mái tài liệu, video ngắn và ảnh",,0,,FPTShop
Huỳnh Thị Huyền_185241,FPTShop,00925043,Huỳnh Thị Huyền,5,Mua đúng đợt giảm giá nên thấy hời quá. Chỉ tội pin hơi mau hết nhưng mà hiệu năng đỉnh nên vẫn đáng mua.,,0,,FPTShop
Dương Văn Tùng_185041,FPTShop,00925043,Dương Văn Tùng,5,"Giao hàng nhanh chóng, đóng gói cẩn thận. Nhân viên FPT nhiệt tình tư vấn cho mình rất chu đáo.",,0,,FPTShop
Đinh Thị Kim Oanh_185040,FPTShop,00925043,Đinh Thị Kim Oanh,5,"Con máy này chạy mượt mà, mở nhiều app cũng không giật lag. Pin trâu nữa, đi làm cả ngày mới phải sạc.",,0,,FPTShop
Trần Đức Duy_185039,FPTShop,00925043,Trần Đức Duy,5,Mua đúng đợt giảm giá nên thấy hời quá. Chỉ tội pin hơi mau hết nhưng mà hiệu năng đỉnh nên vẫn đáng mua.,,0,,FPTShop
Ngô Thị Trang_185038,FPTShop,00925043,Ngô Thị Trang,5,"Đẹp lung linh, sang trọng và cầm chắc tay lắm. Mình rất hài lòng với thiết kế của con máy này.",,0,,FPTShop
Lý Văn Sơn_183295,FPTShop,00925043,Lý Văn Sơn,5,"E này đáng tiền thật, mượt mà từ hiệu năng đến ngoại hình. Bác nào cần mua thì cứ mạnh dạn nhé.",,0,,FPTShop
Hồ Ngọc Quang_175332,FPTShop,00912016,Hồ Ngọc Quang,,"máy có màn hình OLED tuyệt đẹp, nhưng là OLED gương nên sẽ chói, nhưng giá này khó mà đỏi hỏi chống chói xịn",,0,,FPTShop
Đinh Thị Kim Ngân_145293,FPTShop,00912016,Đinh Thị Kim Ngân,4.0,"Nhân viên shop giao tận nơi, hướng dẫn setup Windows và Office HS21, cực kỳ tận tâm.",,0,,FPTShop
Trịnh Bích Ngọc_143706,FPTShop,00912016,Trịnh Bích Ngọc,5.0,Thấy yên tâm vì được bảo hành cũng như tư vấn nhiệt tình,,0,,FPTShop
Lê Minh Tuấn_143174,FPTShop,00912016,Lê Minh Tuấn,5.0,"áy nhẹ, xoay 360 độ tiện học và ghi chú bằng Pen. Màn hình OLED 14 inch hiển thị quá đẹp. Nhân viên FPT Shop giao nhanh, còn hướng dẫn cách sử dụng Touch và Pen, rất chu đáo.",,0,,FPTShop
Ngô Văn Hùng_141557,FPTShop,00912016,Ngô Văn Hùng,5.0,"Dùng Premiere và After Effects render video 4K mượt, AI hỗ trợ tăng tốc rất đáng tiền.",,0,,FPTShop
Ngô Quốc Việt_141399,FPTShop,00912016,Ngô Quốc Việt,5.0,Máy quá tuyệt cho thiết kế và vẽ digital. Màn hình OLED 2.8K quá đẹp,,0,,FPTShop
Kpă Y Nhi_145451,FPTShop,00918931,Kpă Y Nhi,4,CPU i5 giúp xử lý công việc văn phòng rất nhanh.,,0,,FPTShop
Nguyễn Văn Hưng_145369,FPTShop,00918931,Nguyễn Văn Hưng,5,"Nhân viên tư vấn nhiệt tình và dễ hiểu, xuống tiền luôn không nói nhiều",,0,,FPTShop
Hồ Bảo Ngọc_143294,FPTShop,00918931,Hồ Bảo Ngọc,5,Đây là một máy gaming phổ thông phù hợp cho người muốn bước đầu chơi game.,,0,,FPTShop
Hồ Bảo Ngọc_141470,FPTShop,00918931,Hồ Bảo Ngọc,5,"SSD cho tốc độ copy file nhanh, cài game nhanh chóng.",,0,,FPTShop
Đặng Thị Ngọc Hân_141403,FPTShop,00918931,Đặng Thị Ngọc Hân,5,"Máy chạy mượt các game như Valorant, LOL ở mức FPS cao.",,0,,FPTShop
Ngô Minh Tuấn_141339,FPTShop,00918931,Ngô Minh Tuấn,4,CPU i5 giúp xử lý công việc văn phòng rất nhanh.,,0,,FPTShop
Đinh Quang Trường_143015,FPTShop,00915483,Đinh Quang Trường,5,"Máy khởi động nhanh, resume từ sleep tức thì, phục vụ tốt workflow hàng ngày. SSD 512GB còn dư cho dữ liệu công việc.",,0,,FPTShop
Đặng Minh Nhật_142712,FPTShop,00915483,Đặng Minh Nhật,4,"Màn WUXGA hiển thị rõ ràng, độ phân giải phù hợp cho công việc soạn thảo và đọc dữ liệu. Máy mỏng nhẹ, dễ mang theo.",,0,,FPTShop
Trần Thu Hà_142509,FPTShop,00915483,Trần Thu Hà,5,"Đặt chân vào FPT sản phẩm nào tôi cũng được tư vấn nhiệt tình, chi tiết chế độ bảo hành",,0,,FPTShop
Huỳnh Quốc Tuấn_141590,FPTShop,00915483,Huỳnh Quốc Tuấn,5,Giao hàng tận nhà và nhanh chóng sản phẩm chất lượng tư vấn quá đỉnh chóp,,0,,FPTShop
Đặng Thị Nga_141484,FPTShop,00915483,Đặng Thị Nga,5,"Thời lượng pin ổn, đủ cho cả buổi làm việc nhẹ, thiết kế thân thiện với người đi nhiều. Bàn phím và touchpad cho trải nghiệm nhập liệu tốt.",,0,,FPTShop
Hồ Văn Nam_141351,FPTShop,00915483,Hồ Văn Nam,5,"Đặt chân vào FPT sản phẩm nào tôi cũng được tư vấn nhiệt tình, chi tiết chế độ bảo hành",,0,,FPTShop
Hồng Hạnh_59034,FPTShop,00909889,Hồng Hạnh,4,Nhân viên giao hàng hỗ trợ nhiệt tình,,0,,FPTShop
Hoàng Lan_59023,FPTShop,00909889,Hoàng Lan,5,Giao hàng nhanh. Làm việc và chơi game tuyệt đỉnh,,0,,FPTShop
Yến Nhi_59022,FPTShop,00909889,Yến Nhi,1,Chỉ dám vào xem cho biết chứ chưa đủ sức chốt đơn.,,0,,FPTShop
Thu Mai_59021,FPTShop,00909889,Thu Mai,4,"Chạy mượt, tốc độ tải game cực nhanh, chỉ ước giá mềm thêm chút xíu nữa thôi",,0,,FPTShop
Thúy Ngân_59020,FPTShop,00909889,Thúy Ngân,5,Sờ vào là thấy sức mạnh công nghệ đỉnh cao. Nhìn em ấy là đã thấy mình như pro gamer rồi.,,0,,FPTShop
Cúc Phương_59018,FPTShop,00909889,Cúc Phương,5,"Cỗ máy chiến game đỉnh của đỉnh, không một tựa game nào làm khó được em này",,0,,FPTShop
Lê Hoàng Nam_143969,FPTShop,00918487,Lê Hoàng Nam,5,"32GB RAM mở cùng lúc Photoshop, Illustrator, Chrome vẫn mượt. Máy hơi ấm khi mở nhiều ứng dụng nặng nhưng không quá khó chịu",,0,,FPTShop
Lê Văn Sang_142786,FPTShop,00918487,Lê Văn Sang,5,"Máy xoay 360 độ tiện ghi chú, học online và viết bài bằng Pen rất thích. Pin dùng được cả buổi. Giao hàng FPT Shop nhanh, nhân viên hướng dẫn tận tình mọi tính năng",,0,,FPTShop
Ngô Thị Diệu Linh_142345,FPTShop,00918487,Ngô Thị Diệu Linh,5,"Soạn thảo văn bản gõ phím êm lắm, màn hình cũng không làm đau mắt đâu",,0,,FPTShop
Lê Hoài An_142063,FPTShop,00918487,Lê Hoài An,5,Chơi game nhẹ như Liên Minh max setting vẫn mượt,,0,,FPTShop
Dương Hữu Tài_141744,FPTShop,00918487,Dương Hữu Tài,5,"Ở Bình Dương mà giao nhanh ghê, nhận được sớm còn được cài đặt hộ",,0,,FPTShop
Lý Thùy Dương_144232,FPTShop,00912017,Lý Thùy Dương,3,"Dùng ở mức ổn định, giá cũng hợp lý rồi",,0,,FPTShop
Trần Ngọc Ánh_141743,FPTShop,00912017,Trần Ngọc Ánh,5,"Mở nhiều IDE, Photoshop, Illustrator cùng lúc vẫn mượt, AI hỗ trợ xử lý nhanh. Nhân viên FPT Shop hướng dẫn bật AI và cài driver, rất chuyên nghiệp",,0,,FPTShop
Vũ Hữu Hoàng_141658,FPTShop,00912017,Vũ Hữu Hoàng,5,"Giao nhanh lắm, còn cài đặt hỗ trợ cơ bản nữa",,0,,FPTShop
Phan Ngọc Minh_141558,FPTShop,00912017,Phan Ngọc Minh,4,"Shop giao hàng nhanh, test máy trước khi giao, hướng dẫn tận tình, cảm giác yên tâm",,0,,FPTShop
Trịnh Thị Hồng Nhung_141400,FPTShop,00912017,Trịnh Thị Hồng Nhung,5,"Máy nhỏ gọn, xoay 360 độ tiện đi học hoặc ghi chú",,0,,FPTShop
Trịnh Thùy Linh_145586,FPTShop,00912938,Trịnh Thùy Linh,5.0,"Nhân viên FPT hỗ trợ kích hoạt bảo hành, kiểm tra số seri trên web Apple ngay tại shop",,0,,FPTShop
Lý Văn Hòa_142376,FPTShop,00912938,Lý Văn Hòa,5.0,"Dựng video 4K timeline dài mà không giật. 1TB lưu được cả tuần project, không phải gắn SSD ngoài nữa. Điểm trừ nhỏ là máy hơi ấm khi xuất video lâu, nhưng vẫn mượt",,0,,FPTShop
Nguyễn Thảo Nhi_142375,FPTShop,00912938,Nguyễn Thảo Nhi,5.0,"Nhân viên nhiệt tình thế, chu đáo từ lúc bước chân vào đến lúc bước chân ra",,0,,FPTShop
Hoàng Nam Phương_142318,FPTShop,00912938,Hoàng Nam Phương,4.0,"Dùng hơn 1 tháng chưa gặp lỗi. Máy ổn định, hiệu năng cao",,0,,FPTShop
Y Suê Hmok_139824,FPTShop,00912938,Y Suê Hmok,5.0,"FPT cho trả góp 0%, thủ tục nhanh, chỉ mất 15 phút. Nhân viên kiên nhẫn giải thích từng bước. Máy mới khui seal trước mặt khách, mình cảm giác yên tâm",,0,,FPTShop
nguyễn tuấn minh_135061,FPTShop,00912938,nguyễn tuấn minh,,macbook pro M4 có phù hợp học lập trình ko?\n,,0,,FPTShop
Hồ Thiện Nhân_142900,FPTShop,00912022,Hồ Thiện Nhân,5,"Chơi Liên Minh max setting nhẹ nhàng, GPU AI hỗ trợ tính toán nhanh. Máy hơi ấm khi chơi lâu nhưng không khó chịu.",,0,,FPTShop
Trần Minh Hoàng_142480,FPTShop,00912022,Trần Minh Hoàng,5,"Mở VS Code + Docker + Chrome vài tab cùng lúc vẫn mượt, AI hỗ trợ xử lý tác vụ nhanh hơn mình tưởng. Máy ấm thôi, quạt chạy êm. Nhân viên shop còn hướng dẫn bật AI và kiểm tra bảo hành, phục vụ rất chuyên nghiệp",,0,,FPTShop
Trịnh Ngọc Sơn_141983,FPTShop,00912022,Trịnh Ngọc Sơn,5,"FPT Shop test kỹ trước khi giao, nhân viên hướng dẫn tận tình, cảm giác rất chuyên nghiệp",,0,,FPTShop
Phan Bích Trâm_141746,FPTShop,00912022,Phan Bích Trâm,5,"Học online, lướt web, vẽ, xem phim, tất cả đều mượt. Pin ổn, màn hình OLED sống động, xoay 360 độ tiện vô cùng",,0,,FPTShop
Lê Bảo Trâm_140484,FPTShop,00912022,Lê Bảo Trâm,5,Rất chuyên nghiệp từ tư vấn đến kỹ thuật viên cài đặt hỗ trợ,,0,,FPTShop
Dương Anh Tuấn_52698,FPTShop,00909345,Dương Anh Tuấn,5,Đã sử dụng được 2 tuần thấy tốt pin xài lâu mà máy cũng mượt. Nhưng pin không trâu như quảng cáo nhé\n,,0,,FPTShop
Ngô Thị Minh_52685,FPTShop,00909345,Ngô Thị Minh,5,"laptop dùng tốt nhé, nhân viên giao hàng rất nhiệt tình\n",,0,,FPTShop
Võ Hồng Hà_52669,FPTShop,00909345,Võ Hồng Hà,1,"Dùng đươc, hôm trước có lỗi phát sinh hên shop xử lý nhanh. Nhưng hơi buồn vì mới mua mà đã có lỗi tý. Giờ thì ổn rồi\n",,0,,FPTShop
Vũ Thị Thủy_52657,FPTShop,00909345,Vũ Thị Thủy,4,Máy mới mua được 1 tháng hiện tại máy sử dụng chưa phát hiện sự cố gì tạm thời ổn\n\n,,0,,FPTShop
Bùi Minh Khang_52645,FPTShop,00909345,Bùi Minh Khang,5,"đã từng mua khá nhiều máy, giờ chuyển qua dòng này cảm thấy rất ổn\n\n",,0,,FPTShop
Đặng Thị Thu_52634,FPTShop,00909345,Đặng Thị Thu,4,"Thời lượng pin đủ dùng cho một ngày làm việc, nhưng nếu cải thiện thêm sẽ tốt hơn nhé. Dùng vài tháng vẫn rất ưng ý\n",,0,,FPTShop
Hoàng Thiên Long_144988,FPTShop,00913622,Hoàng Thiên Long,5,Với tầm giá này có i7 Gen 13 + RTX 4050 + 32GB RAM là quá tốt. Hợp cho game thủ và cả người làm việc đa nhiệm.,,0,,FPTShop
Trần Thị Hồng Nhung_144076,FPTShop,00913622,Trần Thị Hồng Nhung,5,"Máy chạy rất khỏe, 32GB RAM thực sự quá dư cho nhu cầu của mình. Chạy nhiều ứng dụng cùng lúc không hề giật. Chơi GTA V max setting vẫn mượt.",,0,,FPTShop
Đinh Thu Hà_142557,FPTShop,00913622,Đinh Thu Hà,5,"Loa nghe ổn trong phòng nhỏ, nhưng không quá to, nên mình cắm tai nghe khi chơi game để nghe rõ bước chân.",,0,,FPTShop
Trần Thị Ngọc_142556,FPTShop,00913622,Trần Thị Ngọc,5,"Màn hình 144Hz mượt, nhưng màu sắc chỉ ở mức trung bình, ai làm đồ họa chuyên sâu có thể cần màn ngoài để chuẩn màu.",,0,,FPTShop
Dương Minh Hải_142555,FPTShop,00913622,Dương Minh Hải,5,"Điểm mình ưng nhất là tản nhiệt tốt, quạt kêu to khi full load nhưng bù lại máy mát, không lo tụt FPS khi chơi lâu.",,0,,FPTShop
Lý Minh Khôi_144892,FPTShop,00917165,Lý Minh Khôi,5,"Màn hình 15,6″ cảm ứng rất tiện khi vuốt, scroll trong web/app dễ hơn. Độ phân giải FHD cho hình ảnh sắc nét, màu ổn, dù độ sáng không quá cao nên ánh sáng mạnh còn hơi khó nhìn.",,0,,FPTShop
Ama Hwing_142668,FPTShop,00917165,Ama Hwing,5,"Mình dùng HP ProBook 450 G10 khoảng 3 tuần, hiệu năng i5-1340P xử lý Office, Chrome nhiều tab, Zoom và app thiết kế nhẹ đều trơn tru, chưa hề xảy ra độ trễ — 16GB RAM giúp đa nhiệm rất mượt.",,0,,FPTShop
Y Suê Hmok_141770,FPTShop,00917165,Y Suê Hmok,5,"Thiết kế máy gọn gàng, vỏ hợp kim + nhựa cao cấp cho cảm giác cứng cáp. Máy dày vừa phải, trọng lượng chấp nhận được để mang theo làm việc di động.",,0,,FPTShop
Nguyễn Tấn Phát_141723,FPTShop,00917165,Nguyễn Tấn Phát,5,"Thiết kế máy gọn gàng, vỏ hợp kim + nhựa cao cấp cho cảm giác cứng cáp. Máy dày vừa phải, trọng lượng chấp nhận được để mang theo làm việc di động.",,0,,FPTShop
Hoàng Trúc Lam_140304,FPTShop,00917165,Hoàng Trúc Lam,5,Pin dùng ổn: nếu dùng Office + trình duyệt + email thì máy kéo được ~5–6 tiếng; nếu bật màn hình sáng cao + app nặng thì thời lượng giảm đáng kể.,,0,,FPTShop
Hoàng Thu Trang_140303,FPTShop,00917165,Hoàng Thu Trang,5,"Touchpad mượt, phím gõ vừa tay, hành trình phím đủ dùng cho văn phòng & gõ lâu; nhưng hơi tiếc là không có đèn nền phím khi dùng trong phòng tối.",,0,,FPTShop
